{
  "schema_version": "1.2.2",
  "policy_version": "entity-policy-2026-01",
  "decision_id": "99999999-9999-4999-8999-999999999999",
  "draft_id": "11111111-1111-4111-8111-111111111111",
  "draft_version": 1,
  "draft_hash": "aaaaaaaaaaaaaaaaaaaaaaaaaaaaaaaaaaaaaaaaaaaaaaaaaaaaaaaaaaaaaaaa",
  "decision": "approve_for_exact_review",
  "reviewer": {
    "reviewer_id": "entity-reviewer-1",
    "role": "entity_reviewer",
    "session_id": "review-session-0001"
  },
  "reason": "Evidence reviewed.",
  "evidence_ids": ["22222222-2222-4222-8222-222222222222"],
  "decided_at": "2026-07-15T09:00:00Z"
}
